Column Header	name	mixs_6_slot_name	different?	Definition	Guidance	Expected Value	syntax	Category	Associated Packages	Origin	Notes	GitHub Ticket	coalesced	no_quest	explicit_packs	packlist
chemical administration/addition treatment	chem_administration	chem_administration	TRUE	List of chemical compounds administered to the host or site where sampling occurred, and when (e.g. Antibiotics, n fertilizer, air filter); can include multiple compounds. For chemical entities of biological interest ontology (chebi) (v 163), http://purl.bioontology.org/ontology/chebi			{termLabel} {[termID]}; {timestamp}	required where applicable	soil; sediment; pore_water; plant_associated; water; water_extract_biosolid; water_extract_soil; mixed_culture; pure_culture; culture_environmental	MIxS		https://github.com/GenomicsStandardsConsortium/mixs/issues/133	chem_administration	chem_administration	soil; sediment; pore_water; plant_associated; water; water_extract_biosolid; water_extract_soil; mixed_culture; pure_culture; culture_environmental	['soil', 'sediment', 'pore_water', 'plant_associated', 'water', 'water_extract_biosolid', 'water_extract_soil', 'mixed_culture', 'pure_culture', 'culture_environmental']
chemical administration	chem_administration	chem_administration	TRUE	List of chemical compounds administered to the host or site where sampling occurred, and when (e.g. Antibiotics, n fertilizer, air filter); can include multiple compounds. For chemical entities of biological interest ontology (chebi) (v 163), http://purl.bioontology.org/ontology/chebi			CHEBI {termLabel} {[termID]}; {timestamp}		sediment; pore_water; water_extract_biosolid; water	MIxS			chem_administration	chem_administration	sediment; pore_water; water_extract_biosolid; water	['sediment', 'pore_water', 'water_extract_biosolid', 'water']
Isolation and growth conditions	isol_growth_condt	isol_growth_condt	TRUE	Publication reference in the form of pubmed ID (pmid), digital object identifier (doi) or url for isolation and growth condition specifications of the organism/material. When DOI is not available, provide details in text.			{DOI} or {URL} or {text}	required where applicable	mixed_culture; pure_culture; culture_environmental	MIxS	this is in mixs core, but I'm not sure it should be? 		isol_growth_condt	isol_growth_condt	mixed_culture; pure_culture; culture_environmental	['mixed_culture', 'pure_culture', 'culture_environmental']
isolation and growth condition	isol_growth_condt	isol_growth_condt	TRUE	Publication reference in the form of pubmed ID (pmid), digital object identifier (doi) or url for isolation and growth condition specifications of the organism/material			{PMID|DOI|URL}		water_extract_biosolid	MIxS			isol_growth_condt	isol_growth_condt	water_extract_biosolid	['water_extract_biosolid']
size-fraction lower threshold	size_frac_low	size_frac_low	TRUE	Refers to the mesh/pore size used to pre-filter/pre-sort the sample. Materials larger than the size threshold are excluded from the sample			{value}{text}	required where applicable	pore_water; water; water_extract_soil; culture_environmental	MIxS			size_frac_low	size_frac_low	pore_water; water; water_extract_soil; culture_environmental	['pore_water', 'water', 'water_extract_soil', 'culture_environmental']
size-fraction lower threshold	size_frac_low	size_frac_low	TRUE	Refers to the mesh/pore size used to pre-filter/pre-sort the sample. Materials larger than the size threshold are excluded from the sample			{float} {unit}		pore_water; water	MIxS			size_frac_low	size_frac_low	pore_water; water	['pore_water', 'water']
size-fraction upper threshold	size_frac_up	size_frac_up	TRUE	Refers to the mesh/pore size used to retain the sample. Materials smaller than the size threshold are excluded from the sample			{value}{text}	required where applicable	pore_water; water; water_extract_soil; culture_environmental	MIxS			size_frac_up	size_frac_up	pore_water; water; water_extract_soil; culture_environmental	['pore_water', 'water', 'water_extract_soil', 'culture_environmental']
size-fraction upper threshold	size_frac_up	size_frac_up	TRUE	Refers to the mesh/pore size used to retain the sample. Materials smaller than the size threshold are excluded from the sample			{float} {unit}		pore_water; water	MIxS			size_frac_up	size_frac_up	pore_water; water	['pore_water', 'water']
